{
  "$id": "https://star-wars-codex-data/schema/work.schema.json",
  "$schema": "https://json-schema.org/draft/2020-12/schema",
  "additionalProperties": false,
  "properties": {
    "bookType": {
      "type": "string"
    },
    "canonStatus": {
      "enum": [
        "canon",
        "non-canon",
        "other"
      ],
      "type": "string"
    },
    "creators": {
      "items": {
        "additionalProperties": false,
        "properties": {
          "name": {
            "minLength": 1,
            "type": "string"
          },
          "role": {
            "type": "string"
          },
          "slug": {
            "type": "string"
          }
        },
        "required": [
          "name"
        ],
        "type": "object"
      },
      "type": "array"
    },
    "displayTitle": {
      "minLength": 1,
      "type": "string"
    },
    "editionIds": {
      "items": {
        "additionalProperties": false,
        "properties": {
          "type": {
            "enum": [
              "isbn13",
              "isbn10",
              "asin",
              "audibleAsin",
              "upc",
              "diamondCode"
            ],
            "type": "string"
          },
          "value": {
            "type": "string"
          }
        },
        "required": [
          "type",
          "value"
        ],
        "type": "object"
      },
      "type": "array"
    },
    "editions": {
      "items": {
        "additionalProperties": false,
        "properties": {
          "asin": {
            "type": "string"
          },
          "audibleAsin": {
            "type": "string"
          },
          "extent": {
            "type": "number"
          },
          "imprint": {
            "type": "string"
          },
          "isPrimary": {
            "type": "boolean"
          },
          "isbn10": {
            "type": "string"
          },
          "isbn13": {
            "type": "string"
          },
          "kind": {
            "enum": [
              "print",
              "ebook",
              "audio"
            ],
            "type": "string"
          },
          "onsale": {
            "type": "string"
          },
          "upc": {
            "type": "string"
          }
        },
        "required": [
          "kind"
        ],
        "type": "object"
      },
      "type": "array"
    },
    "era": {
      "type": "string"
    },
    "format": {
      "type": "string"
    },
    "inUniverseDate": {
      "additionalProperties": false,
      "properties": {
        "endYear": {
          "type": "integer"
        },
        "startYear": {
          "type": "integer"
        }
      },
      "type": "object"
    },
    "movie": {
      "additionalProperties": false,
      "properties": {
        "movieType": {
          "type": "string"
        },
        "mpaaRating": {
          "type": "string"
        },
        "runtimeMinutes": {
          "type": "number"
        },
        "subtitle": {
          "type": "string"
        }
      },
      "type": "object"
    },
    "parentWorkSlug": {
      "type": "string"
    },
    "periodical": {
      "additionalProperties": false,
      "properties": {
        "imprint": {
          "type": "string"
        },
        "pageCount": {
          "type": "number"
        },
        "publicationKind": {
          "type": "string"
        },
        "type": {
          "type": "string"
        }
      },
      "type": "object"
    },
    "relatedWorkSlugs": {
      "items": {
        "type": "string"
      },
      "type": "array"
    },
    "releaseDate": {
      "type": "string"
    },
    "releaseDisplayState": {
      "type": "string"
    },
    "releaseStatus": {
      "type": "string"
    },
    "slug": {
      "minLength": 1,
      "type": "string"
    },
    "synopsis": {
      "type": "string"
    },
    "title": {
      "minLength": 1,
      "type": "string"
    }
  },
  "required": [
    "slug",
    "title",
    "displayTitle",
    "format",
    "canonStatus",
    "releaseDisplayState"
  ],
  "title": "Work",
  "type": "object"
}
