{
  "canonStatus": "canon",
  "creators": [
    {
      "name": "Greg Pak",
      "role": "writer",
      "slug": "greg-pak"
    },
    {
      "name": "Raffaele Ienco",
      "role": "artist",
      "slug": "raffaele-ienco"
    },
    {
      "name": "Mark Paniccia",
      "role": "editor",
      "slug": "mark-paniccia"
    },
    {
      "name": "Joe Caramagna",
      "role": "letterer",
      "slug": "joe-caramagna"
    },
    {
      "name": "Raffaele Ienco",
      "role": "inker",
      "slug": "raffaele-ienco"
    },
    {
      "name": "Raffaele Ienco",
      "role": "penciler",
      "slug": "raffaele-ienco"
    },
    {
      "name": "In-Hyuk Lee",
      "role": "coverArtist",
      "slug": "in-hyuk-lee"
    },
    {
      "name": "Neeraj Menon",
      "role": "colorist",
      "slug": "neeraj-menon"
    }
  ],
  "displayTitle": "Darth Vader (2020) #06",
  "era": "ageOfRebellion",
  "format": "periodicalIssue",
  "inUniverseDate": {
    "startYear": 3
  },
  "parentWorkSlug": "darth-vader-2020",
  "periodical": {
    "publicationKind": "comic"
  },
  "releaseDate": "2020-10-14T00:00:00.000Z",
  "releaseDisplayState": "released",
  "releaseStatus": "released",
  "slug": "darth-vader-2020-06",
  "synopsis": "Darth Vader failed to turn his son, Luke Skywalker, to the dark side of the Force.\n\nNo...Luke was too weak to join his father in overthrowing Emperor Palpatine.\n\nVader sought revenge against those who hid Luke from him for all of these years, and in doing so nearly betrayed his master. It did not go unnoticed by Palpatine... time for Vader's next lesson.",
  "title": "Darth Vader (2020) #06"
}
