{
  "canonStatus": "non-canon",
  "creators": [
    {
      "name": "W. Haden Blackman",
      "role": "writer",
      "slug": "w-haden-blackman"
    },
    {
      "name": "Michael Heisler",
      "role": "colorist",
      "slug": "michael-heisler"
    },
    {
      "name": "Agustin Alessio",
      "role": "inker",
      "slug": "agustin-alessio"
    },
    {
      "name": "Agustin Alessio",
      "role": "letterer",
      "slug": "agustin-alessio"
    },
    {
      "name": "Agustin Alessio",
      "role": "penciler",
      "slug": "agustin-alessio"
    },
    {
      "name": "Agustin Alessio",
      "role": "artist",
      "slug": "agustin-alessio"
    },
    {
      "name": "Dave Wilkins",
      "role": "coverArtist",
      "slug": "dave-wilkins"
    }
  ],
  "displayTitle": "Darth Vader and the Ghost Prison #2",
  "era": "fallOfTheJedi",
  "format": "periodicalIssue",
  "inUniverseDate": {
    "startYear": -19
  },
  "parentWorkSlug": "darth-vader-and-the-ghost-prison-graphic-novel",
  "periodical": {
    "pageCount": 32,
    "publicationKind": "comic"
  },
  "releaseDate": "2012-06-20T00:00:00.000Z",
  "releaseDisplayState": "released",
  "releaseStatus": "released",
  "slug": "darth-vader-and-the-ghost-prison-2",
  "synopsis": "Graduating cadet Tohm’s first night as an Imperial officer has already seen him assisting Darth Vader in fighting a traitorous uprising, saving Emperor Palpatine from a deadly plague weapon, and keeping the peace between Vader and the cybernetic Moff Trachta. Now Tohm and Vader have infiltrated the deathly stillness of the abandoned Jedi Temple to confront the secrets of Vader’s past, and to learn the facts about the Ghost Prison! * An Imperial cadet fights at the side of the Dark Lord! * A brand-new series by Haden Blackman!",
  "title": "Darth Vader and the Ghost Prison #2"
}
