{
  "canonStatus": "canon",
  "creators": [
    {
      "name": "Casey Lowe",
      "role": "director",
      "slug": "casey-lowe"
    },
    {
      "name": "Christian Streaty",
      "role": "writer",
      "slug": "christian-streaty"
    }
  ],
  "displayTitle": "Fossil Hunt",
  "era": "highRepublic",
  "format": "tvEpisode",
  "parentWorkSlug": "young-jedi-adventures-s2",
  "releaseDate": "2025-05-09T00:00:00.000Z",
  "releaseDisplayState": "released",
  "releaseStatus": "released",
  "slug": "young-jedi-adventures-s2e41",
  "synopsis": "\"Fossil Hunt\" is the second part of the twenty-first episode of the second season the animated series Star Wars: Young Jedi Adventures. It was released on Disney+ on March 19, 2025.",
  "title": "Fossil Hunt"
}
