{
  "canonStatus": "non-canon",
  "creators": [
    {
      "name": "Ken Stephenson",
      "role": "director",
      "slug": "ken-stephenson"
    },
    {
      "name": "Ben Burtt",
      "role": "writer",
      "slug": "ben-burtt"
    },
    {
      "name": "Michael Reaves",
      "role": "writer",
      "slug": "michael-reaves"
    }
  ],
  "displayTitle": "Tail of the Roon Comets",
  "format": "tvEpisode",
  "parentWorkSlug": "star-wars-droids-tv-series-season-1-s01",
  "releaseDate": "1985-11-09T00:00:00.000Z",
  "releaseDisplayState": "released",
  "releaseStatus": "released",
  "slug": "star-wars-droids-tv-series-season-1-s01-star-wars-droids-tv-series-s01e10",
  "synopsis": "R2-D2, C-3PO and Mungo Baobab are captured by the Empire on the way to the Roon system.",
  "title": "Tail of the Roon Comets"
}
