{
  "canonStatus": "canon",
  "displayTitle": "Thrawn: The Manga",
  "format": "periodical",
  "periodical": {
    "publicationKind": "comic"
  },
  "releaseDate": "2026-09-29T00:00:00.000Z",
  "releaseDisplayState": "released",
  "releaseStatus": "released",
  "slug": "thrawn-the-manga",
  "title": "Thrawn: The Manga"
}
