{
  "bookType": "other",
  "canonStatus": "non-canon",
  "creators": [
    {
      "name": "Dave Land",
      "role": "writer",
      "slug": "dave-land"
    },
    {
      "name": "Davidé Fabbri",
      "role": "penciler",
      "slug": "david-fabbri"
    },
    {
      "name": "Christian Dalla Vecchia",
      "role": "inker",
      "slug": "christian-dalla-vecchia"
    },
    {
      "name": "Dan Jackson",
      "role": "colorist",
      "slug": "dan-jackson"
    },
    {
      "name": "Steve Dutro",
      "role": "letterer",
      "slug": "steve-dutro"
    },
    {
      "name": "Chris Bachalo",
      "role": "coverArtist",
      "slug": "chris-bachalo"
    }
  ],
  "displayTitle": "Infinities: The Empire Strikes Back",
  "era": "multiEra",
  "format": "periodical",
  "periodical": {
    "imprint": "Dark Horse Comics",
    "publicationKind": "comic"
  },
  "releaseDate": "2002-07-10T00:00:00.000Z",
  "releaseDisplayState": "released",
  "releaseStatus": "released",
  "slug": "infinities-esb",
  "synopsis": "Take the events and characters from one of the classic Star Wars films, throw in one happenstance, mishap, or technical glitch beyond the characters' control, and watch how that changes everything. In Dark Horse's first foray into Infinities (Star Wars Infinities: A New Hope), Luke Skywalker's valiant torpedo attack on the Death Star failed due to a faulty detonator -- an event no one could have foreseen -- and the Rebellion was dealt a debilitating setback. In Infinities -- The Empire Strikes Back, Han Solo's desperate attempt to locate his friend Luke in the icy wastes of the planet Hoth is ",
  "title": "Star Wars Infinities: The Empire Strikes Back"
}
