{
  "bookType": "juniorReader",
  "canonStatus": "non-canon",
  "creators": [
    {
      "name": "Christopher Golden",
      "role": "writer",
      "slug": "christopher-golden"
    },
    {
      "name": "Eric Cherry",
      "role": "artist",
      "slug": "eric-cherry"
    }
  ],
  "displayTitle": "Choose Your Own Star Wars Adventure: A New Hope",
  "editions": [
    {
      "imprint": "Bantam Skylark",
      "isPrimary": true,
      "kind": "print",
      "onsale": "1998-05-09T00:00:00.000Z"
    }
  ],
  "format": "book",
  "periodical": {
    "publicationKind": "comic"
  },
  "releaseDate": "1998-05-09T00:00:00.000Z",
  "releaseDisplayState": "released",
  "releaseStatus": "released",
  "slug": "choose-your-own-star-wars-adventure-a-new-hope",
  "title": "Choose Your Own Star Wars Adventure: A New Hope"
}
