{
  "canonStatus": "non-canon",
  "creators": [
    {
      "name": "Jim Woodring",
      "role": "writer",
      "slug": "jim-woodring"
    },
    {
      "name": "Art Wetherell",
      "role": "penciler",
      "slug": "art-wetherell"
    },
    {
      "name": "Monty Sheldon",
      "role": "inker",
      "slug": "monty-sheldon"
    },
    {
      "name": "James Sinclair",
      "role": "colorist",
      "slug": "james-sinclair"
    },
    {
      "name": "Steve Dutro",
      "role": "letterer",
      "slug": "steve-dutro"
    },
    {
      "name": "Ryder Windham",
      "role": "editor",
      "slug": "ryder-windham"
    },
    {
      "name": "Scott Tice",
      "slug": "scott-tice"
    },
    {
      "name": "Steve Bissette",
      "role": "coverArtist",
      "slug": "steve-bissette"
    },
    {
      "name": "Cam Kennedy",
      "role": "coverArtist",
      "slug": "cam-kennedy"
    }
  ],
  "displayTitle": "Jabba the Hutt: The Garr Suppoon Hit",
  "format": "periodicalIssue",
  "periodical": {
    "publicationKind": "comic"
  },
  "releaseDate": "1995-04-01T00:00:00.000Z",
  "releaseDisplayState": "released",
  "releaseStatus": "released",
  "slug": "jabba-the-hutt-the-garr-suppoon-hit",
  "synopsis": "Jabba the Hutt lives to negotiate, and the art of the deal is his only discipline. But the goods he trades are the lives of others, and in that line of business you can't lose your head. In this self-contained story, Jabba finds himself bartering with Garr Suppoon, rumored to be an absolute devil at the negotiating table. There's a valuable lesson to be learned here: In a deal with the devil, you can always refuse. In a deal with Jabba, it's not advised.",
  "title": "Jabba the Hutt: The Garr Suppoon Hit"
}
