{
  "canonStatus": "canon",
  "displayTitle": "Insider #188",
  "format": "periodicalIssue",
  "parentWorkSlug": "star-wars-insider",
  "periodical": {
    "publicationKind": "magazine",
    "type": "singleIssue"
  },
  "releaseDisplayState": "announced",
  "slug": "star-wars-insider-insider-188",
  "title": "Insider #188"
}
