{
  "canonStatus": "canon",
  "displayTitle": "Adventures (2017) #27 - Ghosts Of Kashyyyk part 1",
  "era": "riseOfTheFirstOrder",
  "format": "periodicalIssue",
  "inUniverseDate": {
    "startYear": 34
  },
  "parentWorkSlug": "star-wars-adventures-2017",
  "periodical": {
    "publicationKind": "comic"
  },
  "releaseDate": "2019-10-28T00:00:00.000Z",
  "releaseDisplayState": "released",
  "releaseStatus": "released",
  "slug": "star-wars-adventures-2017-27-ghosts-of-kashyyyk-part-1",
  "title": "Star Wars Adventures (2017) #27 - Ghosts Of Kashyyyk part 1"
}
