{
  "bookType": "graphicNovel",
  "canonStatus": "canon",
  "displayTitle": "Return of the Jedi: The Special Edition",
  "format": "book",
  "releaseDisplayState": "announced",
  "slug": "return-of-the-jedi-the-special-edition",
  "synopsis": "The trilogy aimed to renew the movies in the minds of both the older and the younger audience, and to prepare the way for the upcoming release of Star Wars: Episode I The Phantom Menace.",
  "title": "Return of the Jedi: The Special Edition"
}
