{
  "bookType": "referenceBook",
  "canonStatus": "canon",
  "displayTitle": "The Mandalorian - The Art & Imagery Collector's Edition, Volume Two",
  "editions": [
    {
      "imprint": "Titan Comics",
      "isPrimary": true,
      "kind": "print",
      "onsale": "2021-02-02T00:00:00.000Z"
    }
  ],
  "format": "book",
  "periodical": {
    "publicationKind": "comic"
  },
  "releaseDate": "2021-02-02T00:00:00.000Z",
  "releaseDisplayState": "released",
  "releaseStatus": "released",
  "slug": "star-wars-the-mandalorian-the-art-imagery-collectors-edition-volume-two",
  "synopsis": "A collection of art from the end credits of Star Wars: the Mandalorian chapters 5-8 and more!Includes art as seen in the hit Disney+ TV series directed by Dave Filoni and John Favreau, starring Pedro Pascal, as illustrated by some of Lucasfilm's finest artists",
  "title": "Star Wars: The Mandalorian - The Art & Imagery Collector's Edition, Volume Two"
}
