{
  "canonStatus": "canon",
  "displayTitle": "Thrawn: Alliances #1",
  "era": "ageOfRebellion",
  "format": "periodicalIssue",
  "parentWorkSlug": "thrawn-alliances-comics",
  "periodical": {
    "publicationKind": "comic"
  },
  "releaseDate": "2018-07-24T00:00:00.000Z",
  "releaseDisplayState": "upcoming",
  "slug": "thrawn-alliances-comics-thrawn-alliances-1",
  "synopsis": "Grand Admiral Thrawn and Darth Vader ally against a threat to the Empire in this new novel from bestselling author Timothy Zahn.\n\"I have sensed a disturbance in the Force.\"\nOminous words under any circumstances, but all the more so when uttered by Emperor Palpatine. On Batuu, at the edges of the Unknown Regions, a threat to the Empire is taking root&mdash;its existence little more than a glimmer, its consequences as yet unknowable. But it is troubling enough to the Imperial leader to warrant investigation by his most powerful agents: ruthless enforcer Lord Darth Vader and brilliant strategist Grand Admiral Thrawn. Fierce rivals for the emperor's favor, and outspoken adversaries on Imperial affairs&mdash;including the Death Star project&mdash;the formidable pair seem unlikely partners for such a crucial mission. But the Emperor knows it's not the first time Vader and Thrawn have joined forces. And there's more behind his royal command than either man suspects.\nIn what seems like a lifetime ago, General Anakin Skywalker of the Galactic Republic, and Commander Mitth'raw'nuruodo, officer of the Chiss Ascendancy, crossed paths for the first time. One on a desperate personal quest, the other with motives unknown&hellip;and undisclosed. But facing a gauntlet of dangers on a far-flung world, they forged an uneasy alliance&mdash;neither remotely aware of what their futures held in store.\nNow, thrust together once more, they find themselves bound again for the planet where they once fo",
  "title": "Thrawn: Alliances #1"
}
