{
  "canonStatus": "canon",
  "creators": [
    {
      "name": "Cavan Scott",
      "role": "writer",
      "slug": "cavan-scott"
    },
    {
      "name": "Derek Charm",
      "role": "artist",
      "slug": "derek-charm"
    },
    {
      "name": "Nick Brokenshire",
      "role": "artist",
      "slug": "nick-brokenshire"
    },
    {
      "name": "Nicoletta Baldari",
      "role": "artist",
      "slug": "nicoletta-baldari"
    }
  ],
  "displayTitle": "Adventures: Shadow of Vader's Castle #1",
  "era": "newRepublic",
  "format": "periodicalIssue",
  "inUniverseDate": {
    "startYear": 4
  },
  "parentWorkSlug": "star-wars-adventures-shadow-of-vader-s-castle-2020",
  "periodical": {
    "publicationKind": "comic"
  },
  "releaseDate": "2020-11-04T00:00:00.000Z",
  "releaseDisplayState": "released",
  "releaseStatus": "released",
  "slug": "star-wars-adventures-shadow-of-vader-s-castle-2020-1",
  "synopsis": "Continuing the Vader’s Castle series, this single-issue comic proves that even after good conquers evil, Vader’s looming shadow continues to haunt those who dare trespass on his domain long after his death.",
  "title": "Star Wars Adventures: Shadow of Vader's Castle #1"
}
