{
  "canonStatus": "canon",
  "creators": [
    {
      "name": "Leonard Kirk",
      "role": "penciler",
      "slug": "leonard-kirk"
    },
    {
      "name": "Cory Hamscher",
      "role": "inker",
      "slug": "cory-hamscher"
    },
    {
      "name": "Mark Paniccia",
      "role": "editor",
      "slug": "mark-paniccia"
    },
    {
      "name": "Guru Efx",
      "role": "colorist",
      "slug": "guru-efx"
    },
    {
      "name": "Tom Taylor",
      "role": "writer",
      "slug": "tom-taylor"
    },
    {
      "name": "Bria Lavorgna",
      "role": "writer",
      "slug": "bria-lavorgna"
    },
    {
      "name": "Vc Travis Lanham",
      "role": "letterer",
      "slug": "vc-travis-lanham"
    },
    {
      "name": "Phil Noto",
      "role": "coverArtist",
      "slug": "phil-noto"
    }
  ],
  "displayTitle": "Age Of Resistance: General Hux (2019) #1",
  "format": "periodicalIssue",
  "periodical": {
    "publicationKind": "comic"
  },
  "releaseDisplayState": "announced",
  "slug": "age-of-resistance-general-hux-2019-1",
  "title": "Age Of Resistance: General Hux (2019) #1"
}
