{
  "canonStatus": "canon",
  "creators": [
    {
      "name": "Charles Soule",
      "role": "writer",
      "slug": "charles-soule"
    },
    {
      "name": "Angel Unzueta",
      "role": "artist",
      "slug": "angel-unzueta"
    },
    {
      "name": "Joe Caramagna",
      "role": "artist",
      "slug": "joe-caramagna"
    },
    {
      "name": "Arif Pianto",
      "role": "artist",
      "slug": "arif-pianto"
    },
    {
      "name": "Phil Noto",
      "role": "artist",
      "slug": "phil-noto"
    },
    {
      "name": "Angel Unzueta",
      "role": "inker",
      "slug": "angel-unzueta"
    },
    {
      "name": "Angel Unzueta",
      "role": "penciler",
      "slug": "angel-unzueta"
    },
    {
      "name": "Phil Noto",
      "role": "coverArtist",
      "slug": "phil-noto"
    },
    {
      "name": "Vc Joe Caramagna",
      "role": "letterer",
      "slug": "vc-joe-caramagna"
    },
    {
      "name": "Jordan D. White",
      "role": "editor",
      "slug": "jordan-d-white"
    },
    {
      "name": "Arif Pianto",
      "role": "colorist",
      "slug": "arif-pianto"
    }
  ],
  "displayTitle": "Poe Dameron #24: Legend Found, Part V",
  "era": "riseOfTheFirstOrder",
  "format": "periodicalIssue",
  "inUniverseDate": {
    "startYear": 34
  },
  "parentWorkSlug": "poe-dameron",
  "periodical": {
    "publicationKind": "comic"
  },
  "releaseDate": "2018-02-14T00:00:00.000Z",
  "releaseDisplayState": "released",
  "releaseStatus": "released",
  "slug": "poe-dameron-24",
  "synopsis": "Lor San Tekka has been captured…again! And it's up to Black Squadron to save him. Meanwhile, Terex has his own plans in motion…to finally free himself from the grasp of the First Order!",
  "title": "Poe Dameron #24: Legend Found, Part V"
}
