{
  "canonStatus": "canon",
  "creators": [
    {
      "name": "Greg Pak",
      "role": "writer",
      "slug": "greg-pak"
    },
    {
      "name": "Will Sliney",
      "role": "artist",
      "slug": "will-sliney"
    }
  ],
  "displayTitle": "The Phantom Menace 25th Anniversary Special",
  "era": "fallOfTheJedi",
  "format": "periodical",
  "periodical": {
    "publicationKind": "comic"
  },
  "releaseDate": "2024-05-01T00:00:00.000Z",
  "releaseDisplayState": "released",
  "releaseStatus": "released",
  "slug": "the-phantom-menace-25th-anniversary-special-2024",
  "synopsis": "CELEBRATING THE 25TH ANNIVERSARY OF THE PHANTOM MENACE WITH AN ALL-NEW STORY! Explore the earliest days and secret inner life of ANAKIN SKYWALKER with never-before-seen, revelatory stories set before, after and between the scenes of the classic movie! Featuring the dream of a JEDI, the gift of a TUSKEN RAIDER, the heart of a GUNGAN, the ache of a mother and the horror of a hero!",
  "title": "The Phantom Menace 25th Anniversary Special"
}
