{
  "bookType": "other",
  "canonStatus": "non-canon",
  "creators": [
    {
      "name": "Ian Doescher",
      "role": "writer",
      "slug": "ian-doescher"
    }
  ],
  "displayTitle": "William Shakespeare's The Merry Rise of Skywalker: Star Wars Part the Ninth",
  "editions": [
    {
      "imprint": "Quirk Books",
      "isPrimary": true,
      "kind": "print",
      "onsale": "2020-07-28T00:00:00.000Z"
    }
  ],
  "format": "book",
  "periodical": {
    "publicationKind": "comic"
  },
  "releaseDate": "2020-07-28T00:00:00.000Z",
  "releaseDisplayState": "released",
  "releaseStatus": "released",
  "slug": "william-shakespeares-the-merry-rise-of-skywalker-star-wars-part-the-ninth",
  "synopsis": "William Shakespeare's The Merry Rise of Skywalker is a non-canon junior novelization of Star Wars: The Rise of Skywalker. Written by Ian Doescher in the style of William ShakespeareComplete your collection of the William Shakespeare's Star Wars® series and experience the blockbuster finale to the Star Wars® saga in a brand-new way, here reimagined as though it had been penned by the Bard of Avon.As our story opens, a sea of troubles threatens the valiant Resistance, who are pursued by the sound and fury of the vile First Order. Can Rey, Poe, Finn, Rose, BB-8, Chewbacca, and their allies overcome such toil and trouble? Shall Kylo Ren be proven fortune's fool or master of his fate? What will become of the House of Skywalker? And is all well that ends wellAuthentic meter, stage directions, reimagined movie scenes and dialogue, and hidden Easter eggs will entertain and impress fans of Star Wars® and Shakespeare alike. Every scene and character from the film appears in the book, along with twenty woodcut-style illustrations that depict an Elizabethan version of the Star Wars® galaxy.[",
  "title": "William Shakespeare's The Merry Rise of Skywalker: Star Wars Part the Ninth"
}
