{
  "canonStatus": "canon",
  "displayTitle": "Insider #158",
  "format": "periodicalIssue",
  "parentWorkSlug": "star-wars-insider",
  "periodical": {
    "publicationKind": "magazine"
  },
  "releaseDisplayState": "announced",
  "slug": "star-wars-insider-insider-158",
  "title": "Insider #158"
}
